<?xml version="1.0" encoding="UTF-8"?>
<!DOCTYPE locale SYSTEM "../../../../../lib/pkp/dtd/locale.dtd">

<!--
  * locale.xml
  *
  * Copyright (c) 2003-2012 John Willinsky
  * Distributed under the GNU GPL v2. For full terms see the file docs/COPYING.
  *
  * Localization strings for the tr_TR (Turkish) locale.
  *
  * $Id$
  -->
 
<locale name="tr_TR" full_name = "Turkish">
	<message key="plugins.generic.webfeed.displayName">Web Feed Plugin</message>
	<message key="plugins.generic.webfeed.description">This plugin produces RSS/Atom web syndication feeds for the current issue.</message>

	<message key="plugins.generic.webfeed.settings">Settings</message>
	<message key="plugins.generic.webfeed.settings.issue">Display web feed links on issue pages only.</message>
	<message key="plugins.generic.webfeed.settings.homepage">Display web feed links on homepage and issue pages only.</message>
	<message key="plugins.generic.webfeed.settings.all">Display web feed links on all journal pages.</message>

	<message key="plugins.generic.webfeed.settings.currentIssue">Display items in current published issue.</message>
	<message key="plugins.generic.webfeed.settings.recentArticles">most recent published items.</message>
	<message key="plugins.generic.webfeed.settings.recentItemsRequired">Please enter a positive integer for recent published items.</message>
	<message key="plugins.generic.webfeed.atom.altText">Atom logo</message>
	<message key="plugins.generic.webfeed.rss1.altText">RSS1 logo</message>
	<message key="plugins.generic.webfeed.rss2.altText">RSS2 logo</message>
</locale>
