<?xml version="1.0" encoding="UTF-8"?>
<!DOCTYPE locale SYSTEM "../../../../../lib/pkp/dtd/locale.dtd">

<!--
  * plugins/generic/counter/locale/zh_CN/locale.xml
  *
  * Copyright (c) 2014-2016 Simon Fraser University Library
  * Copyright (c) 2003-2016 John Willinsky
  * Distributed under the GNU GPL v2. For full terms see the file docs/COPYING.
  *
  * Localization strings for the zh_CN (简体中文) locale.
  *
  -->
 
<locale name="zh_CN" full_name="简体中文">
	<message key="plugins.generic.counter.description"><![CDATA[计数器插件提供关于站点活动的记录和<a href="http://www.projectcounter.org/about.html" target="_new">计数</a>报告.]]></message>
	<message key="plugins.generic.counter">计数器统计</message>
	<message key="plugins.generic.counter.migrate">日志文件迁移</message>
	<message key="plugins.generic.counter.1a.title">期刊报告1(R2): 按月份与杂志的全文文章点击请求</message>
	<message key="plugins.generic.counter.1a.title1">期刊报告1(R2)</message>
	<message key="plugins.generic.counter.1a.title2">按照月份与期刊的全文请求成功次数( {$year})</message>
	<message key="plugins.generic.counter.1a.dateRun">日运行:</message>
	<message key="plugins.generic.counter.1a.publisher">Publisher</message>
	<message key="plugins.generic.counter.1a.platform">平台</message>
	<message key="plugins.generic.counter.1a.printIssn">ISSN</message>
	<message key="plugins.generic.counter.1a.onlineIssn">在线ISSN</message>
	<message key="plugins.generic.counter.1a.ytdTotal">YTD Total</message>
	<message key="plugins.generic.counter.1a.ytdHtml">YTD HTML</message>
	<message key="plugins.generic.counter.1a.ytdPdf">YTD PDF</message>
	<message key="plugins.generic.counter.1a.totalForAllJournals">总计所有期刊</message>
</locale>
