<?xml version="1.0" encoding="UTF-8"?>
<!DOCTYPE locale SYSTEM "../../../../../lib/pkp/dtd/locale.dtd">

<!--
  * plugins/generic/customBlockManager/locale/cs_CZ/locale.xml
  *
  * Copyright (c) 2013-2014 Simon Fraser University Library
  * Copyright (c) 2003-2014 John Willinsky
  * Distributed under the GNU GPL v2. For full terms see the file docs/COPYING.
  *
  * Localization strings for the cs_CZ locale.
  *
  -->
 
<locale name="cs_CZ" full_name="Czech">
	<message key="plugins.generic.customBlockManager.displayName">Manažer uživatelských panelů</message>
	<message key="plugin.generic.customBlockManager.introduction"><![CDATA[Můžete použít tento plugin pro přidání nebo smazání pluginů uživatelských panelů. Potom můžete editovat obsah prostřednictvím stránky <a href="{$systemPluginsUrl}">Systémových pluginů</a> (v sekci panelových pluginů).  Pro umístění vašeho pluginu na požadované místo v postraním panelu, přejděte ke  <a href="{$setupStep56}">Kroku 5.6</a>]]></message>
	<message key="plugins.generic.customBlockManager.settings">Nastavení</message>
	<message key="plugins.generic.customBlockManager.blockName">Název panelu</message>	
	<message key="plugins.generic.customBlockManager.action">Akce</message>	
	<message key="plugins.generic.customBlockManager.delete">Smazat</message>	
	<message key="plugins.generic.customBlockManager.addBlock">Přidat panel</message>	

	<message key="plugins.generic.customBlock.content">Obsah</message>
	<message key="plugins.generic.customBlock.saved">Obsah panelu byl uložen.</message>
	<message key="plugins.generic.customBlock.nameSuffix">(Plugin uživatelských panelů)</message>
	<message key="plugins.generic.customBlock.description">Toto je uživatelem vytvořený panel.</message>
	<message key="plugins.generic.customBlock.editContent">Editovat obsah postranního panelu</message>
	<message key="plugins.generic.customBlock.contentRequired">Je vyžadován nějaký obsah. Pokud si přejete smazat tento panel, můžete tak udělat pomocí pluginu Manažer panelů nebo srušením výběru tohoto panelu v Kroku 5 v nastavení časopisu.</message>
	<message key="plugins.generic.customBlock.edit">Editovat</message>
</locale>
