<?xml version="1.0" encoding="UTF-8"?>
<!DOCTYPE locale SYSTEM "../../../../../lib/pkp/dtd/locale.dtd">

<!--
  * plugins/generic/webFeed/locale/fi_FI/locale.xml
  *
  * Copyright (c) 2014-2019 Simon Fraser University
  * Copyright (c) 2003-2019 John Willinsky
  * Distributed under the GNU GPL v2. For full terms see the file docs/COPYING.
  * Localization information: https://pkp.sfu.ca/wiki/index.php?title=Translating_OxS
  * Localization strings.
  -->
 
<locale name="fi_FI" full_name="Suomi">
	<message key="plugins.generic.webfeed.displayName">Verkkosyötelisäosa</message>
	<message key="plugins.generic.webfeed.description">Tämä lisäosa tuottaa RSS/Atom-verkkosisältösyötteitä uusimmalle numerolle.</message>

	<message key="plugins.generic.webfeed.settings">Asetukset</message>
	<message key="plugins.generic.webfeed.settings.issue">Näytä verkkosyötelinkit vain numeroiden sivuilla.</message>
	<message key="plugins.generic.webfeed.settings.homepage">Näytä verkkosyötelinkit vain etusivulla ja numeroiden sivuilla.</message>
	<message key="plugins.generic.webfeed.settings.all">Näytä verkkosyötelinkit julkaisun kaikilla sivuilla.</message>

	<message key="plugins.generic.webfeed.settings.currentIssue">Näytä kohteet uusimmassa julkaistussa numerossa.</message>
	<message key="plugins.generic.webfeed.settings.recent">Näytä kiinteä määrä viimeisimpiä kohteita.</message>
	<message key="plugins.generic.webfeed.settings.recentArticles">Näytettävien kohteiden määrä</message>
	<message key="plugins.generic.webfeed.settings.recentItemsRequired">Anna positiivinen kokonaisluku viimeisimmille julkaistuille kohteille.</message>
	<message key="plugins.generic.webfeed.atom.altText">Atom-logo</message>
	<message key="plugins.generic.webfeed.rss1.altText">RSS1-logo</message>
	<message key="plugins.generic.webfeed.rss2.altText">RSS2-logo</message>
</locale>
