<?xml version="1.0" encoding="UTF-8"?>
<!DOCTYPE locale SYSTEM "../../../../../lib/pkp/dtd/locale.dtd">

<!--
  * plugins/generic/openAds/locale/ro_RO/locale.xml
  *
  * Copyright (c) 2013-2014 Simon Fraser University Library
  * Copyright (c) 2003-2013 Siavash Miri and Alec Smecher
  * Distributed under the GNU GPL v2. For full terms see the file docs/COPYING.
  *
  * Localization strings for the ro_RO (Română) locale.
  * KOSSON FECIT
  -->
 
<locale name="ro_RO" full_name="Română">
	<message key="plugins.generic.openads.description">Modulul OpenAds permite introducerea de anunţuri comerciale de la serverul OpenAds pentru a fi introduse în OJS.</message>
	<message key="plugins.generic.openads.descriptionUnconfigured"><![CDATA[Modulul OpenAds permite introducerea de anunţuri comerciale de la serverul OpenAds pentru a fi introduse în OJS. <strong>Citiţi fişierul README din plugins/generic/openAds pentru informare la activarea acestui modul.</strong>]]></message>
	<message key="plugins.generic.openads">Modulul OpenAds</message>
	<message key="plugins.generic.openads.settings.description">Folosiţi acest formular pentru a selecta zonele OpenAds care vor fi afişate în OJS pentru fiecare locaţie posibilă.</message>
	<message key="plugins.generic.openads.manager.settings">Setări</message>
	<message key="plugins.generic.openads.error.missingParameter">Cel puţin unul dintre parametrii de configurare al OpenAds nu a putut fi citit din fişierul de configurare. Parametrii ceruţi sunt dbhost, dbuser, dbpassword, dbname, url_prefix, şi table_prefix.</message>
	<message key="plugins.generic.openads.error.dbConnectionError">Nu m-am putut conecta la baza de date OpenAds.</message>

	<message key="plugins.generic.openads.headerAd">Header Ad</message>
	<message key="plugins.generic.openads.contentAd">Content Ad</message>
	<message key="plugins.generic.openads.sidebarAd">Sidebar Ad</message>

	<message key="plugins.generic.openads.orientation.left">Stânga</message>
	<message key="plugins.generic.openads.orientation.centre">Centru</message>
	<message key="plugins.generic.openads.orientation.right">Dreapta</message>
	<message key="plugins.generic.openads.error.configFileNotFound">Fișierul de configurare {$filename} nu a putut fi accesat.</message>
</locale>
