<?xml version="1.0" encoding="UTF-8"?>
<!DOCTYPE locale SYSTEM "../../../../../lib/pkp/dtd/locale.dtd">

<!--
  * plugins/generic/customLocale/locale/pt_PT/locale.xml
  *
  * Copyright (c) 2013-2015 Simon Fraser University Library
  * Copyright (c) 2003-2015 John Willinsky
  * Distributed under the GNU GPL v2. For full terms see the file docs/COPYING.
  *
  * Localization strings for the pt_PT (Português) locale.
  *
  -->
 
<locale name="pt_PT" full_name="Português">
	<message key="plugins.generic.customLocale.name">Plugin de Customização de Idioma</message>
	<message key="plugins.generic.customLocale.description">Este plugin permite a customização do idioma da interface padrão do sistema.</message>

	<message key="plugins.generic.customLocale.longDescription">Esta página lista todos os idiomas actualmente instalados na revista.</message>
	<message key="plugins.generic.customLocale.localeDescription">Esta página lista todos os ficheiros disponíveis para o idioma seleccionado.</message>
	<message key="plugins.generic.customLocale.fileDescription">Indique o texto no campo correspondente. Deixe o campo em branco para utilizar a tradução original.</message>
	<message key="plugins.generic.customLocale.localeName">Título para a tradução</message>
	<message key="plugins.generic.customLocale.localeKey">Chave</message>
	<message key="plugins.generic.customLocale.localeKeyValue">Valor</message>
	<message key="plugins.generic.customLocale.customize">Customizar</message>
	<message key="plugins.generic.customLocale.availableLocales">Idiomas disponíveis</message>

	<message key="plugins.generic.customLocale.locale">Idioma {$locale}</message>
	<message key="plugins.generic.customLocale.localeFiles">Ficheiros de tradução</message>
	<message key="plugins.generic.customLocale.file.filename">Nome do ficheiro</message>
	<message key="plugins.generic.customLocale.file.edit">Editando {$filename}</message>
	<message key="plugins.generic.customLocale.file.reference">Texto original</message>
	<message key="plugins.generic.customLocale.file.custom">Texto customizado</message>
	<message key="plugins.generic.customLocale.localeKey.description">Insira uma chave de tradução completa para pesquisar.</message>
</locale>
