<?xml version="1.0" encoding="UTF-8"?>
<!DOCTYPE locale SYSTEM "../../../../../lib/pkp/dtd/locale.dtd">

<!--
  * plugins/generic/counter/locale/eu_ES/locale.xml
  *
  * Copyright (c) 2013-2014 Simon Fraser University Library
  * Copyright (c) 2003-2014 John Willinsky
  * Distributed under the GNU GPL v2. For full terms see the file docs/COPYING.
  *
  * Localization strings for the eu_ES (Basque (Euskara)) locale.
  *
  -->
 
<locale name="eu_ES" full_name="Euskara">
	<message key="plugins.reports.counter.description"><![CDATA[COUNTER pluginak webgunearen jarduera erregistratzen du eta <a href="http://www.projectcounter.org/about.html" target="_new">COUNTER</a> moduko txostena ematen du.]]></message>
	<message key="plugins.reports.counter">COUNTER estatistikak</message>
	<message key="plugins.reports.counter.migrate">Migratu log-fitxategia</message>
	<message key="plugins.reports.counter.1a.title">Aldizkariaren 1. txostena (R2): Testu osoko artikulu-eskaerak hilabetez eta aldizkariz</message>
	<message key="plugins.reports.counter.1a.title1">Aldizkariaren 1. txostena (R2)</message>
	<message key="plugins.reports.counter.1a.title2">Testu osoko artikulu-eskaera zuzenak hilabetez eta egunkariz ({$year} urtea)</message>
	<message key="plugins.reports.counter.1a.dateRun">Data:</message>
	<message key="plugins.reports.counter.1a.publisher">Argitaratzailea</message>
	<message key="plugins.reports.counter.1a.platform">Plataforma</message>
	<message key="plugins.reports.counter.1a.printIssn">Inprimatzeko ISSN</message>
	<message key="plugins.reports.counter.1a.onlineIssn">Lineako ISSN</message>
	<message key="plugins.reports.counter.1a.ytdTotal">Aurten guztira</message>
	<message key="plugins.reports.counter.1a.ytdHtml">HTML</message>
	<message key="plugins.reports.counter.1a.ytdPdf">PDF</message>
	<message key="plugins.reports.counter.1a.totalForAllJournals">Aldizkari guztien totala</message>
</locale>
