<?xml version="1.0" encoding="UTF-8"?>
<!DOCTYPE locale SYSTEM "../../../../../lib/pkp/dtd/locale.dtd">

<!--
  * plugins/importexport/pubmed/locale/en_US/locale.xml
  *
  * Copyright (c) 2014-2018 Simon Fraser University
  * Copyright (c) 2003-2018 John Willinsky
  * Distributed under the GNU GPL v2. For full terms see the file docs/COPYING.
  * Localization information: https://pkp.sfu.ca/wiki/index.php?title=Translating_OxS
  * Localization strings.
  -->
 
<locale name="en_US" full_name="U.S. English">
	<message key="plugins.importexport.pubmed.displayName">PubMed XML Export Plugin</message>
	<message key="plugins.importexport.pubmed.description">Export article metadata in PubMed XML format for indexing in MEDLINE.</message>
	
	<message key="plugins.importexport.pubmed.export">Export Data</message>
	<message key="plugins.importexport.pubmed.export.issues">Export Issues</message>
	<message key="plugins.importexport.pubmed.export.selectIssue">Select an Issue to export.</message>
	<message key="plugins.importexport.pubmed.export.articles">Export Articles</message>
	<message key="plugins.importexport.pubmed.export.selectArticle">Select Articles to export.</message>
	
	<message key="plugins.importexport.pubmed.cliUsage"><![CDATA[Usage: 
{$scriptName} {$pluginName} [xmlFileName] [journal_path] articles [articleId1] [articleId2] ...
{$scriptName} {$pluginName} [xmlFileName] [journal_path] issue [issueId]
]]></message>
	<message key="plugins.importexport.pubmed.cliError">ERROR:</message>

	<message key="plugins.importexport.pubmed.export.error.issueNotFound">No issue matched the specified issue ID "{$issueId}".</message>
	<message key="plugins.importexport.pubmed.export.error.articleNotFound">No article matched the specified article ID "{$articleId}".</message>


</locale>
