<?xml version="1.0" encoding="UTF-8"?>
<!DOCTYPE locale SYSTEM "../../../../../lib/pkp/dtd/locale.dtd">

<!--
  * plugins/pubIds/urn/locale/en_US/locale.xml
  *
  * Copyright (c) 2014-2019 Simon Fraser University
  * Copyright (c) 2003-2019 John Willinsky
  * Distributed under the GNU GPL v2. For full terms see the file docs/COPYING.
  * Localization information: https://pkp.sfu.ca/wiki/index.php?title=Translating_OxS
  * Localization strings.
  -->

<locale name="en_US" full_name="U.S. English">
	<message key="plugins.pubIds.urn.displayName">URN</message>
	<message key="plugins.pubIds.urn.description">This plugin enables the assignment of the Uniform Resource Names to the issues, articles and galleys in OJS.</message>

	<!-- settings form -->
	<message key="plugins.pubIds.urn.manager.settings.description">Please configure the URN plugin to be able to manage and use URNs in OJS:</message>

	<message key="plugins.pubIds.urn.manager.settings.urnObjects">Journal Content</message>
	<message key="plugins.pubIds.urn.manager.settings.urnObjectsRequired">Please choose the objects URNs should be assigned to.</message>
	<message key="plugins.pubIds.urn.manager.settings.explainURNs">Please select the publishing objects that will have Uniform Resource Names (URN) assigned:</message>
	<message key="plugins.pubIds.urn.manager.settings.enableIssueURN">Issues</message>
	<message key="plugins.pubIds.urn.manager.settings.enableSubmissionURN">Articles</message>
	<message key="plugins.pubIds.urn.manager.settings.enableRepresentationURN">Galleys</message>

	<message key="plugins.pubIds.urn.manager.settings.urnPrefix">URN Prefix</message>
	<message key="plugins.pubIds.urn.manager.settings.urnPrefix.description"><![CDATA[The URN prefix is the fix, never changing part of the URN (e.g. "urn:nbn:de:0000-").]]></message>
	<message key="plugins.pubIds.urn.manager.settings.form.urnPrefixPattern"><![CDATA[The URN prefix pattern must be in the form "urn:"&lt;NID&gt;":"&lt;NSS&gt;.]]></message>

	<message key="plugins.pubIds.urn.manager.settings.urnSuffix">URN Suffix</message>
	<message key="plugins.pubIds.urn.manager.settings.urnSuffix.description">A URN suffix can take any form, but must be unique among all publishing objects with the same URN prefix assigned:</message>
	<message key="plugins.pubIds.urn.manager.settings.urnSuffixPattern">Use the pattern entered below to generate URN suffixes. Use %j for journal initials, %v for the volume number, %i for the issue number, %Y for the year, %a for the OJS article ID, %g for the OJS galley ID, %f for the OJS file ID, %p for the page number and %x for "Custom Identifier".</message>
	<message key="plugins.pubIds.urn.manager.settings.urnSuffixPattern.example">For example, vol%viss%ipp%p could create the URN suffix "vol3iss2pp230".</message>
	<message key="plugins.pubIds.urn.manager.settings.urnSuffixPattern.issues">for issues</message>
	<message key="plugins.pubIds.urn.manager.settings.urnSuffixPattern.submissions">for articles</message>
	<message key="plugins.pubIds.urn.manager.settings.urnSuffixPattern.representations">for galleys</message>
	<message key="plugins.pubIds.urn.manager.settings.urnIssueSuffixPatternRequired">Please enter the URN suffix pattern for issues.</message>
	<message key="plugins.pubIds.urn.manager.settings.urnSubmissionSuffixPatternRequired">Please enter the URN suffix pattern for articles.</message>
	<message key="plugins.pubIds.urn.manager.settings.urnRepresentationSuffixPatternRequired">Please enter the URN suffix pattern for galleys.</message>
	<message key="plugins.pubIds.urn.manager.settings.urnSuffixDefault">Use default patterns.</message>
	<message key="plugins.pubIds.urn.manager.settings.urnSuffixDefault.description"><![CDATA[%j.v%vi%i for issues<br />%j.v%vi%i.%a for articles<br />%j.v%vi%i.%a.g%g for galleys.]]></message>
	<message key="plugins.pubIds.urn.manager.settings.urnSuffixCustomIdentifier">Enter an individual URN suffix for each published item. You'll find an additional URN input field on each item's metadata page.</message>
	<message key="plugins.pubIds.urn.manager.settings.checkNo">Check Number</message>
	<message key="plugins.pubIds.urn.manager.settings.checkNo.label">The check number will be automatically calculated and added at the end, as the last digit of an URN.</message>
	<message key="plugins.pubIds.urn.manager.settings.namespace">Namespace</message>
	<message key="plugins.pubIds.urn.manager.settings.namespace.choose">Choose</message>
	<message key="plugins.pubIds.urn.manager.settings.namespace.description">The persistent identifier namespace usually needed for the registration (e.g. at the Deutsche Nationalbibliothek).</message>
	<message key="plugins.pubIds.urn.manager.settings.urnResolver">Resolver URL</message>
	<message key="plugins.pubIds.urn.manager.settings.urnResolver.description">(e.g. http://nbn-resolving.de/)</message>
	<message key="plugins.pubIds.urn.manager.settings.form.urnResolverRequired">Please enter the resolver URL.</message>

	<message key="plugins.pubIds.urn.manager.settings.urnReassign">Reassign URNs</message>
	<message key="plugins.pubIds.urn.manager.settings.urnReassign.description">If you change your URN configuration, URNs that have already been assigned will not be affected. Once the URN configuration is saved, use this button to clear all existing URNs so that the new settings will take effect with existing objects.</message>
	<message key="plugins.pubIds.urn.manager.settings.urnReassign.confirm">Are you sure you wish to delete all existing URNs?</message>

	<!-- metadata form -->
	<message key="plugins.pubIds.urn.editor.urn">URN</message>
	<message key="plugins.pubIds.urn.editor.urnObjectTypeIssue">issue</message>
	<message key="plugins.pubIds.urn.editor.urnObjectTypeSubmission">article</message>
	<message key="plugins.pubIds.urn.editor.urnObjectTypeRepresentation">galley</message>
	<message key="plugins.pubIds.urn.editor.customSuffixMissing">The URN cannot be assigned because the custom suffix is missing.</message>
	<message key="plugins.pubIds.urn.editor.patternNotResolved">The URN cannot be assigned because it contains an unresolved pattern.</message>
	<message key="plugins.pubIds.urn.editor.canBeAssigned">What you see is a preview of the URN. Select the checkbox and save the form to assign the URN.</message>
	<message key="plugins.pubIds.urn.editor.assigned">The URN is assigned to this {$pubObjectType}.</message>
	<message key="plugins.pubIds.urn.editor.urnSuffixCustomIdentifierNotUnique">The given URN suffix is already in use for another published item. Please enter a unique URN suffix for each item.</message>
	<message key="plugins.pubIds.urn.editor.clearObjectsURN">Clear URN</message>
	<message key="plugins.pubIds.urn.editor.clearObjectsURN.confirm">Are you sure you wish to delete the existing URN?</message>
	<message key="plugins.pubIds.urn.editor.clearIssueObjectsURN">Clear Issue Objects URNs</message>
	<message key="plugins.pubIds.urn.editor.clearIssueObjectsURN.confirm">Are you sure you wish to delete the existing issue objects URNs?</message>
	<message key="plugins.pubIds.urn.editor.clearIssueObjectsURN.description">Use the following option to clear URNs of all objects (articles and galleys) currently scheduled for this issue.</message>
	<message key="plugins.pubIds.urn.editor.addCheckNo">Add Check Number</message>
	<!-- assignment form -->
	<message key="plugins.pubIds.urn.editor.assignURN">Assign the URN {$pubId} to this {$pubObjectType}</message>
	<message key="plugins.pubIds.urn.editor.assignURN.emptySuffix">The URN cannot be assigned because the custom suffix is missing.</message>
	<message key="plugins.pubIds.urn.editor.assignURN.pattern">The URN {$pubId} cannot be assigned because it contains an unresolved pattern.</message>
	<message key="plugins.pubIds.urn.editor.assignURN.assigned">The URN {$pubId} has been assigned.</message>
	<!-- errors -->
	<message key="plugins.pubIds.urn.form.checkNoRequired">The check number is missing.</message>

</locale>
