<?xml version="1.0" encoding="UTF-8"?>
<!DOCTYPE locale SYSTEM "../../../../../lib/pkp/dtd/locale.dtd">

<!--
  * plugins/citationFormats/abnt/locale/pt_PT/locale.xml
  *
  * Copyright (c) 2013-2014 Simon Fraser University Library
  * Copyright (c) 2003-2014 John Willinsky
  * Distributed under the GNU GPL v2. For full terms see the file docs/COPYING.
  *
  * Localization strings for this citation plugin in pt_PT.
  *
  -->
 
<locale name="pt_PT" full_name="Português">
	<message key="plugins.citationFormats.abnt.displayName">Plugin Formato de Citação ABNT</message>
	<message key="plugins.citationFormats.abnt.citationFormatName">ABNT</message>
	<message key="plugins.citationFormats.abnt.description">Este plugin implementa o formato de citação ABNT.</message>
	
	<message key="plugins.citationFormats.abnt.manager.settings">Configurações</message>
	<message key="plugins.citationFormats.abnt.manager.AbntCitationSettings">Configurações do formato de citação ABNT</message>
	<message key="plugins.citationFormats.abnt.manager.settings.description">Configurações de campos usados para referências segundo formato ABNT.</message>
	<message key="plugins.citationFormats.abnt.manager.settings.location">Local</message>
	
	
	<message key="plugins.citationFormats.abnt.retrieved"><![CDATA[Disponível em: &lt;<a href="{$url}" target="_new">{$url}</a>&gt;. Acesso em: {$retrievedDate}.]]></message>
</locale>
