<?xml version="1.0" encoding="UTF-8"?>
<!DOCTYPE locale SYSTEM "../../../../../lib/pkp/dtd/locale.dtd">

<!--
  * plugins/auth/ldap/locale/uk_UA/locale.xml
  *
  * Copyright (c) 2014-2019 Simon Fraser University
  * Copyright (c) 2003-2019 John Willinsky
  * Distributed under the GNU GPL v2. For full terms see the file docs/COPYING.
  *
  * LDAP authentication plugin localization strings for the uk_UA (Українська) locale.
  *
  * Translated by Denys Solovianenko, 2011
  * V. I. Vernadsky National Library of Ukraine
  -->
 
<locale name="uk_UA" full_name="Українська">
       <message key="plugins.auth.ldap.displayName">LDAP</message>
       <message key="plugins.auth.ldap.description">Цей модуль дозволяє аутентифікацію та синхронізацію облікових записів користувачів засобами зовнішніх джерел даних LDAP.</message>
       
       <message key="plugins.auth.ldap.settings">Налаштування LDAP</message>
       <message key="plugins.auth.ldap.settings.hostname">Ім'я хоста серверу</message>
       <message key="plugins.auth.ldap.settings.hostname.description">наприклад, "ldap.example.com" або "ldaps://ldap.example.com" (для використання SSL)</message>
       <message key="plugins.auth.ldap.settings.port">Порт серверу</message>
       <message key="plugins.auth.ldap.settings.port.description">Необов'язкове. За замовчуванням 389 (LDAP) або 636 (LDAP через SSL)</message>
       <message key="plugins.auth.ldap.settings.basedn">База DN</message>
       <message key="plugins.auth.ldap.settings.basedn.description">наприклад, "ou=people,dc=example,dc=com"</message>
       <message key="plugins.auth.ldap.settings.managerdn">DN менеджера</message>
       <message key="plugins.auth.ldap.settings.managerdn.description">наприклад, "cn=Manager,dc=example,dc=com"</message>
       <message key="plugins.auth.ldap.settings.managerpwd">Пароль менеджера</message>
       <message key="plugins.auth.ldap.settings.managerpwd.description">DN та пароль менеджера необхідні лише у випадку, якщо дозволена синхронізація профіля/пароля користувача або опції створення користувача. Якщо LDAP буде використовуватися виключно для аутентифікації, ці опції можуть бути опущені.</message>
       <message key="plugins.auth.ldap.settings.uid">Атрибут імені облікового запису</message>
       <message key="plugins.auth.ldap.settings.uid.description">Атрибут, який унікально ідентифікує користувача як об'єкт, наприклад, uid, cn або sAMAccountName.</message>
       <message key="plugins.auth.ldap.settings.pwhash">Шифрування пароля</message>
       <message key="plugins.auth.ldap.settings.saslopt">Налаштування SASL (необов'язкове)</message>
       <message key="plugins.auth.ldap.settings.saslmech">Механізм SASL</message>
       <message key="plugins.auth.ldap.settings.saslmech.description">наприклад, "DIGEST-MD5"</message>
       <message key="plugins.auth.ldap.settings.saslrealm">Realm</message>
       <message key="plugins.auth.ldap.settings.saslauthzid">Неохідний authorization ID</message>
       <message key="plugins.auth.ldap.settings.saslprop">Параметри безпеки SASL</message>
</locale>
