<?xml version="1.0" encoding="UTF-8"?>
<!DOCTYPE locale SYSTEM "../../../../../locale/locale.dtd">

<!--
  * locale.xml
  *
  * Copyright (c) 2003-2010 John Willinsky
  * Distributed under the GNU GPL v2. For full terms see the file docs/COPYING.
  *
  * Localization strings for the en_US (U.S. English) locale.
  *
  * $Id$
  -->
 
<locale name="en_US" full_name="U.S. English">
	<message key="plugins.generic.customLocale.name">Plugin προσαρμογής τοπικών ρυθμίσεων</message>
	<message key="plugins.generic.customLocale.description">Το plugin αυτό ενεργοποιεί την δυνατότητα προσαρμογής του κειμένου της εξ'ορισμού διεπαφής του χρήστη που χρησιμοποιεί το OJS.</message>

	<message key="plugins.generic.customLocale.longDescription">Αυτή η σελίδα εμφανίζει όλες τις τρέχουσες τοπικές ρυθμίσεις που είναι εγκατεστημένες για αυτό το περιοδικό.</message>
	<message key="plugins.generic.customLocale.localeDescription">Αυτή η σελίδα εμφανίζει όλα τα διαθέσιμα αρχεία για την επιλεγμένη τοπική ρύθμιση.</message>
	<message key="plugins.generic.customLocale.fileDescription">Εισάγετε το κείμενό σας στο αντίστοιχο πεδίο προσαρμογής κειμένου. Αφήστε το πεδίο κενό αν επιθυμείτε να χρησιμοποιήσετε το εξ'ορισμού κείμενο του OJS.</message>
	<message key="plugins.generic.customLocale.localeName">Όνομα τοπικής ρύθμισης</message>
	<message key="plugins.generic.customLocale.localeKey">Κλειδί</message>
	<message key="plugins.generic.customLocale.localeKey.description">Εισάγετε ένα ολόκληρο κλειδί τοπικής ρύθμισης για να την αναζητήσετε.</message>
	<message key="plugins.generic.customLocale.localeKeyValue">Τιμή</message>
	<message key="plugins.generic.customLocale.customize">Προσαρμογή</message>
	<message key="plugins.generic.customLocale.availableLocales">Διαθέσιμες τοπικές ρυθμίσεις</message>

	<message key="plugins.generic.customLocale.locale">{$locale} Τοπική Ρύθμιση</message>
	<message key="plugins.generic.customLocale.localeFiles">Τοπικές Ρυθμίσεις</message>
	<message key="plugins.generic.customLocale.file.filename">Όνομα αρχείου</message>
	<message key="plugins.generic.customLocale.file.edit">Επεξεργασία {$filename}</message>
	<message key="plugins.generic.customLocale.file.reference">Εξ'ορισμού κείμενο</message>
	<message key="plugins.generic.customLocale.file.custom">Προσαρμοσμένο κείμενο</message>
</locale>
