<?xml version="1.0" encoding="UTF-8"?>
<!DOCTYPE locale SYSTEM "../../../../../lib/pkp/dtd/locale.dtd">

<!--
  * plugins/generic/browse/locale/ru_RU/locale.xml
  *
  * Copyright (c) 2014-2016 Simon Fraser University Library
  * Copyright (c) 2003-2016 John Willinsky
  * Distributed under the GNU GPL v2. For full terms see the file docs/COPYING.
  *
  * Browse plugin localization strings
  -->
 
<locale name="ru_RU" full_name="Русский">
	<!-- plugin -->
	<message key="plugins.generic.browse.displayName">Просмотр</message>
	<message key="plugins.generic.browse.description">Этот модуль позволяет просмотр по разделам и/или идентификационным типам.</message>

	<!-- URN manager options, setting -->
	<message key="plugins.generic.browse.manager.settings">Настройки</message>
	<message key="plugins.generic.browse.manager.settings.description">Пожалуйста, установите следующие дополнительные инструменты просмотра:</message>

	<message key="plugins.generic.browse.manager.settings.browseSettings">Настройки просмотра</message>
	<message key="plugins.generic.browse.manager.settings.browse">Просмотр</message>
	<message key="plugins.generic.browse.manager.settings.browseByObjects">Виберите объекты, по которым можно будет осуществлять просмотр.</message>
	<message key="plugins.generic.browse.manager.settings.enableBrowseBySections">По разделам</message>
	<message key="plugins.generic.browse.manager.settings.enableBrowseByIdentifyTypes">По идентификационным типам</message>
	<message key="plugins.generic.browse.manager.settings.excludedSections">Исключенные разделы</message>
	<message key="plugins.generic.browse.manager.settings.excludedSections.description">Виберите разделы, которые не следует включать в просмотр.</message>
	<message key="plugins.generic.browse.manager.settings.excludedIdentifyTypes">Исключенные идентификационные типы</message>
	<message key="plugins.generic.browse.manager.settings.excludedIdentifyTypes.description">Виберите идентификационные типы, которые не следует включать в просмотр.</message>

	<message key="plugins.generic.browse.search.sections">По разделам</message>
	<message key="plugins.generic.browse.search.sectionIndex">Просмотр списка разделов</message>
	<message key="plugins.generic.browse.search.sectionDetails">Информация о разделе</message>
	<message key="plugins.generic.browse.search.identifyTypes">По идентификационным типам</message>
	<message key="plugins.generic.browse.search.identifyTypeIndex">Просмотр списка идентификационных типов</message>
	<message key="plugins.generic.browse.search.identifyTypeDetails">Информация об идентификационном типе</message>

</locale>
