<?xml version="1.0" encoding="UTF-8"?>
<!DOCTYPE locale SYSTEM "../../../../../locale/locale.dtd">

<!--
  * locale.xml
  *
  * Copyright (c) 2003-2010 John Willinsky
  * Distributed under the GNU GPL v2. For full terms see the file docs/COPYING.
  *
  * Localization strings for the en_US (U.S. English) locale.
  *
  * $Id$
  -->
 
<locale name="en_US" full_name="U.S. English">
	<message key="plugins.generic.customLocale.name">Công cụ phụ trợ ngôn ngữ tùy biến</message>
	<message key="plugins.generic.customLocale.description">Công cụ này cho phép tùy biến ngôn ngữ giao diện người dụng mặc định trên phần mềm OJS.</message>

	<message key="plugins.generic.customLocale.longDescription">Trang này liệt kê tất cả các ngôn ngữ hiện được cài đặt cho tạp chí này.</message>
	<message key="plugins.generic.customLocale.localeDescription">Trang này liệt kê tất cả các file sẵn có cho ngôn ngữ được chọn.</message>
	<message key="plugins.generic.customLocale.fileDescription">Nhập từ ngữ vào ô chữ tùy biến tương ứng. Để trống ô chữ tùy biến nếu muốn sử dụng từ ngữ mặc định của OJS.</message>
	<message key="plugins.generic.customLocale.localeName">Tên ngôn ngữ</message>
	<message key="plugins.generic.customLocale.localeKey">Nút chữ</message>
	<message key="plugins.generic.customLocale.localeKeyValue">Giá trị</message>
	<message key="plugins.generic.customLocale.customize">Tùy biến</message>
	<message key="plugins.generic.customLocale.availableLocales">Các ngôn ngữ hiện có</message>

	<message key="plugins.generic.customLocale.locale">{$locale} Ngôn ngữ</message>
	<message key="plugins.generic.customLocale.localeFiles">Các file ngôn ngữ</message>
	<message key="plugins.generic.customLocale.file.filename">Tên file</message>
	<message key="plugins.generic.customLocale.file.edit">Sửa {$filename}</message>
	<message key="plugins.generic.customLocale.file.reference">Từ ngữ mặc định</message>
	<message key="plugins.generic.customLocale.file.custom">Từ ngữ tùy biến</message>
</locale>
