<?xml version="1.0" encoding="UTF-8"?>
<!DOCTYPE locale SYSTEM "../../../../../lib/pkp/dtd/locale.dtd">

<!--
  * plugins/generic/announcementFeed/locale/nb_NO/locale.xml
  *
  * Copyright (c) 2014-2018 Simon Fraser University
  * Copyright (c) 2003-2018 John Willinsky
  * Distributed under the GNU GPL v2. For full terms see the file docs/COPYING.
  *
  * Localization strings for the nb_NO (Norsk bokmål) locale.
  *
  -->
 
<locale name="nb_NO" full_name="Norsk bokmål">
	<message key="plugins.generic.announcementfeed.displayName">Programutvidelse for feed av Kunngjøringer.</message>
	<message key="plugins.generic.announcementfeed.description">Denne programutvidelsen produserer RSS/Atom feed av tidsskriftets Kunngjøringer.</message>

	<message key="plugins.generic.announcementfeed.settings">Innstillinger</message>
	<message key="plugins.generic.announcementfeed.settings.all">Vis feed-lenker på alle tidsskriftsider.</message>
	<message key="plugins.generic.announcementfeed.settings.homepage">Vis feed-lenker bare på hjemmesiden og kunngjøringssiden.</message>
	<message key="plugins.generic.announcementfeed.settings.announcement">Vis feed-lenker bare på kunngjøringssiden.</message>
	<message key="plugins.generic.announcementfeed.settings.recentAnnouncements1">Begrens feeden til</message>
	<message key="plugins.generic.announcementfeed.settings.recentAnnouncements2">nyeste kunngjøringer.</message>
	<message key="plugins.generic.announcementfeed.settings.recentItemsRequired">Vennligst oppgi et tall for hvor mange av de nyeste kunngjøringene som skal vises.</message>
	<message key="plugins.generic.announcementfeed.atom.altText">Atom logo</message>
	<message key="plugins.generic.announcementfeed.rss1.altText">RSS1 logo</message>
	<message key="plugins.generic.announcementfeed.rss2.altText">RSS2 logo</message>
</locale>
