<?xml version="1.0" encoding="UTF-8"?>
<!DOCTYPE locale SYSTEM "../../../../../locale/locale.dtd">

<!--
  * locale.xml
  *
  * Copyright (c) 2003-2010 John Willinsky
  * Distributed under the GNU GPL v2. For full terms see the file docs/COPYING.
  *
  * Localization strings for the en_US (U.S. English) locale.
  *
  * $Id$
  -->
 
<locale name="en_US" full_name="U.S. English">
	<message key="plugins.generic.thesisfeed.displayName">پلاکین فید چکیده پایان نامه</message>
	<message key="plugins.generic.thesisfeed.description">این پلاگین فید سندیکائی آر اس اس - اتم برای چکیده پایان نام ها ایجاد میکند</message>

	<message key="plugins.generic.thesisfeed.settings">تنظیمات</message>
	<message key="plugins.generic.thesisfeed.settings.all">نمایش لینک فید در تمام صفحات سایت مجله</message>
	<message key="plugins.generic.thesisfeed.settings.homepage">نمایش لینک فید فقط در صفحه خانگی و صفحه چکیده پایان نامه ها</message>
	<message key="plugins.generic.thesisfeed.settings.thesis">نمایش لینک فید فقط در صفحه چکیده پایان نامه ها</message>
	<message key="plugins.generic.thesisfeed.settings.recentThesis1">فید محدود باشد به</message>
	<message key="plugins.generic.thesisfeed.settings.recentThesis2">چکیده های پایان نامه اخیرا ارسال شده.</message>
	<message key="plugins.generic.thesisfeed.settings.recentItemsRequired">تعداد چکیده های پایان نامه را به صورت عدد صحیح مثبتی وارد کنید.</message>
	<message key="plugins.generic.thesisfeed.atom.altText">لوگوی اتم</message>
	<message key="plugins.generic.thesisfeed.rss1.altText">لوگوی آر اس اس ۱</message>
	<message key="plugins.generic.thesisfeed.rss2.altText">لوگوی آر اس اس ۲</message>
</locale>
