<?xml version="1.0" encoding="UTF-8"?>
<!DOCTYPE locale SYSTEM "../../../../../locale/locale.dtd">

<!--
  * locale.xml
  *
  * Copyright (c) 2003-2010 John Willinsky
  * Distributed under the GNU GPL v2. For full terms see the file docs/COPYING.
  *
  * Localization strings for the fr_CA locale.
  *
  * $Id$
  -->
 
<locale name="fr_CA" full_name="Français (Canada)">
	<message key="plugins.importexport.crossref.displayName">Plugiciel d'exportation CrossRef XML</message>
	<message key="plugins.importexport.crossref.description">Exporter les métadonnées de l'article en format CrossRef XML.</message>
	
	<message key="plugins.importexport.crossref.export">Exporter des données</message>
	<message key="plugins.importexport.crossref.export.issues">Exporter des numéros</message>
	<message key="plugins.importexport.crossref.export.selectIssue">Sélectionner un numéro à exporter</message>
	<message key="plugins.importexport.crossref.export.articles">Exporter des articles</message>
	<message key="plugins.importexport.crossref.export.selectArticle">Sélectionner des articles à exporter</message>
	
	<message key="plugins.importexport.crossref.cliUsage">Utilisation : 
{$scriptName} {$pluginName} [xmlFileName] [journal_path] articles [articleId1] [articleId2] ...
{$scriptName} {$pluginName} [xmlFileName] [journal_path] numéro [issueId]</message>
	<message key="plugins.importexport.crossref.cliError">ERREUR :</message>

	<message key="plugins.importexport.crossref.export.error.issueNotFound">Aucun numéro ne correspond à l'identification de numéro spécifié "{$issueId}".</message>
	<message key="plugins.importexport.crossref.export.error.articleNotFound">Aucun article ne correspond à l'identification d'article spécifié "{$articleId}".</message>

	<message key="plugins.importexport.crossref.errors.noDOIprefix">Il faut spécifier un préfixe DOI valide dans la configuration de la revue afin d'utiliser ce plugiciel.</message>
</locale>
