<?xml version="1.0" encoding="UTF-8"?>
<!DOCTYPE locale SYSTEM "../../lib/pkp/dtd/locale.dtd">

<!--
  * locale/fr_CA/submission.xml
  *
  * Copyright (c) 2014-2019 Simon Fraser University
  * Copyright (c) 2003-2019 John Willinsky
  * Distributed under the GNU GPL v2. For full terms see the file docs/COPYING.
  * Localization information: https://pkp.sfu.ca/wiki/index.php?title=OJS:_French_(fr_CA)
  * Localization strings.
  -->

<locale name="fr_CA" full_name="Français (Canada)">
	<!-- Submission wizard -->

	<!-- Submission Information Modal -->

	<!-- events -->

	<!-- galleys grid -->

	<!-- galley files grid -->
	<message key="submission.submit.form.authorRequiredFields">Les prénom, nom et adresse courriel de chaque auteur sont requis.</message>
	<message key="submission.submit.form.titleRequired">Inscrire le titre de votre article.</message>
	<message key="submission.submit.form.abstractRequired">Inscrire le résumé de votre article.</message>
	<message key="submission.submit.form.contributorRoleRequired">Sélectionner le rôle du contributeur.</message>
	<message key="submission.citationFormat.notFound">Le format de citation n'a pas été repéré.</message>
	<message key="submission.metadataDescription">Ces spécifications sont basées sur l'ensemble d'éléments de métadonnées de Dublin Core, une norme internationale utilisée pour décrire les contenus d'une revue.</message>
	<message key="submission.incomplete">En attente d'approbation</message>
	<message key="submission.submit.form.localeRequired">Sélectionner une langue pour la soumission</message>
	<message key="submission.submit.submissionChecklist">Liste de vérification de la soumission</message>
	<message key="submission.submit.submissionChecklistDescription">Lire et cocher les éléments suivants pour indiquer que vous répondez aux exigences.</message>
	<message key="submission.submit.privacyStatement">Déclaration de confidentialité</message>
	<message key="submission.submit.contributorRole">Rôle du contributeur</message>
	<message key="submission.submit.form.authorRequired">Au moins un auteur est requis.</message>
	<message key="submission.submit.title">Soumettre un article</message>
	<message key="submission.submit.userGroup">Rôle</message>
	<message key="submission.submit.userGroupDescription">Choisissez le rôle sous lequel vous soumettez votre article.</message>
	<message key="submission.upload.selectComponent">Sélectionner l'élément de l'article</message>
	<message key="submission.title">Titre de l'article</message>
	<message key="submission.title.tip">voici une variable avec une valeur erronée</message>
	<message key="submission.submit.newSubmissionMultiple">Commencer une nouvelle soumission dans</message>
	<message key="submission.submit.newSubmissionSingle">Nouvelle soumission</message>
	<message key="grid.action.workflow">Processus éditorial pour la soumission</message>
	<message key="submission.issueEntry">Métadonnées</message>
	<message key="submission.submit.whatNext.description">La revue a été informée de votre soumission et vous a envoyé par courriel une confirmation pour vos dossiers.  Un rédacteur communiquera avec vous lorsque votre soumission aura été examinée.</message>
	<message key="editor.submission.decision.sendExternalReview">Envoyer en évaluation</message>
	<message key="submission.event.issueMetadataUpdated">Les métadonnées pour la publication de la soumission ont été mises à jour.</message>
	<message key="submission.upload.fileContents">Élément de l'article</message>
	<message key="submission.complete">Approuvé</message>
	<message key="grid.action.issueEntry">Voir les métadonnées de la soumission</message>
	<message key="submission.issueEntry.modalTitle">Métadonnées de la soumission et de la publication</message>
	<message key="submission.issueEntry.submissionMetadata">Soumission</message>
	<message key="submission.issueEntry.publicationMetadata">Publication</message>
	<message key="submission.issueEntry.confirm">Assigner l'article à un numéro en vous basant sur les métadonnées ci-dessous.</message>
	<message key="grid.action.galleyInIssueEntry">Les épreuves se trouvent dans le dossier du numéro.</message>
	<message key="submission.event.articleGalleyMadeAvailable">L'article mis en page "{$galleyFormatName}" est disponible.</message>
	<message key="submission.event.articleGalleyMadeUnavailable">L'article mis en page "{$galleyFormatName}" n'est pas disponible.</message>
	<message key="submission.event.publicIdentifiers">Identifiants publics mis à jour.</message>
	<message key="grid.issueEntry.availableGalley.title">Approbation du format</message>
	<message key="grid.issueEntry.availableGalley.removeMessage"><![CDATA[<p>Ce mod`èle de mise en page <em>ne sera plus offert</em>aux lecteurs</p>.]]></message>
	<message key="grid.issueEntry.availableGalley.message"><![CDATA[<p>Ce mod`èle de mise en page <em>sera offert</em>aux lecteurs</p>.]]></message>
	<message key="grid.action.availableArticleGalley">Rendre ce modèle de mise en page disponible</message>
	<message key="submission.galleyFiles">Fichiers de mise en page</message>
	<message key="submission.proofReadingDescription"><![CDATA[Le responsable de la mise en page télécharge les fichiers qui ont été préparés pour publication ici.  Utiliser <em>Assigner un vérificateur</em> pour identifier les auteurs et les autres personnes qui reliront les articles mis en page, avec les fichiers corrigés téléchargés, pour approbation avant la publication.]]></message>
	<message key="grid.action.approveProof">Approuver cette épreuve.</message>
	<message key="grid.action.pageProofApproved">Cette épreuve a été approuvée.</message>
	<message key="submission.submit.titleAndSummary">Titre et résumé</message>
	<message key="submission.submit.upload.description">Télécharger les fichier associés à la soumission, incluant l'article, les fichiers multimedia, les ensembles de données, les oeuvres d'art, etc.</message>
	<message key="submission.pageProofs">Correction d'épreuve</message>
	<message key="submission.confirmSubmit">Êtes-vous certain de vouloir soumettre cet article à la revue?</message>
	<message key="workflow.review.externalReview">Évaluation</message>
	<message key="submission.abstract.wordCount.description">Le résumé doit contenir {$wordCount} mots ou moins.</message>
	<message key="submission.submit.form.wordCountAlert">Votre résumé est trop long. Veuillez le raccourcir selon la limite indiquée.</message>
	<message key="section.any">Aucune rubrique</message>
</locale>
