<?xml version="1.0" encoding="UTF-8"?>
<!DOCTYPE locale SYSTEM "../../../../../lib/pkp/dtd/locale.dtd">

<!--
  * plugins/paymethod/paypal/locale/cs_CZ/locale.xml
  *
  * Copyright (c) 2013-2014 Simon Fraser University Library
  * Copyright (c) 2006-2009 Gunther Eysenbach, Juan Pablo Alperin, MJ Suhonos
  * Distributed under the GNU GPL v2. For full terms see the file docs/COPYING.
  *
  * Localization strings for the cs_CZ (Czech) locale.
  -->
 
<locale name="cs_CZ" full_name="Czech">
	<message key="plugins.paymethod.paypal.displayName">Platba poplatku přes PayPal</message>

	<!-- PayPal Settings Form -->
	<message key="plugins.paymethod.paypal.settings.paypalenable">Povolit PayPal</message>
	<message key="plugins.paymethod.paypal.settings.paypalurl">IPN URL</message>
	<message key="plugins.paymethod.paypal.settings.paypalurl.description"><![CDATA[Toto je URL na službu PayPal - Instant Payment Notification (IPN). Pro testování použijte <u>https://www.sandbox.paypal.com/cgi-bin/webscr</u>; pro produkční systémy použijte <u>https://www.paypal.com/cgi-bin/webscr</u>.]]></message>
	<message key="plugins.paymethod.paypal.settings.selleraccount">Účet prodejce</message>
	<message key="plugins.paymethod.paypal.settings.selleraccount.description">Toto je uživatelské jméno PayPal účtu prodejce, který se má použít - obvykle emailová adresa. Ujistěte se, že máte aktivován Instant Payment Notification (IPN) ve vašem profilu účtu prodejce.</message>
	<message key="plugins.paymethod.paypal.settings.curlNotInstalled">Varování: CURL podpora pro PHP není nainstalována. Podpora PayPal plateb vyžaduje knihovnu CURL a nebude fungovat, dokud nebude nainstalována.</message>
	<message key="plugins.paymethod.paypal.settings">PayPal nastavení</message>

	<!-- PayPal -->
	<message key="plugins.paymethod.paypal">Platba poplatku přes PayPal</message>
	<message key="plugins.paymethod.paypal.description"><![CDATA[PayPal umožňuje uživatelům, ať už jsou nebo nejsou členy PayPal, použít všechny běžné typy platebních karet. Manažer bude muset nastavit <a href="http://www.paypal.com" target="_new">PayPal Business Account</a>.]]></message>
	<message key="plugins.paymethod.paypal.warning">Klikněte na tlačítko Continue níže pro přechod na stránku PayPal, kde můžete použít platební karty pro zaplacení poplatku (bez nutnosti stát se členem PayPal). Po provedení platby použijte tlačítko "Return to Merchant" pro návrat na tuto stránku.</message>
	<message key="plugins.paymethod.paypal.purchase.title">Název</message>
	<message key="plugins.paymethod.paypal.purchase.fee">Poplatek</message>
	<message key="plugins.paymethod.paypal.purchase.description">Popis</message>
	<message key="plugins.paymethod.paypal.purchase.cancelled">Váš nákup byl zrušen.</message>
	<message key="plugins.paymethod.paypal.purchase.cancelled.title">Nákup zrušen</message>
</locale>
